{"duration_ms":173,"exit_status":0,"git":{"branch":"main","commit":"91f5246149a482b894d49df7ac05b22c4e08fa92","dirty":true},"run_id":"arb-step-typecheck-bca518cde3494964a476519a19d86004","schema":"gzkit.arb.step_receipt.v1","stderr_tail":"","stderr_truncated":false,"stdout_tail":"All checks passed!\n","stdout_truncated":false,"step":{"command":["uv","run","ty","check","src"],"name":"typecheck"},"timestamp_utc":"2026-04-25T17:36:26Z"}
