{"duration_ms":21762,"exit_status":0,"git":{"branch":"main","commit":"7e9492bdcb7fe58313ccaae7164bf97df9dbf797","dirty":true},"run_id":"arb-step-unittest-697a99ed07ad40d39124fc338b2a007a","schema":"gzkit.arb.step_receipt.v1","stderr_tail":"----------------------------------------------------------------------\nRan 3249 tests in 21.393s\n\nOK (skipped=1)\n","stderr_truncated":false,"stdout_tail":"","stdout_truncated":false,"step":{"command":["uv","run","-m","unittest","-q"],"name":"unittest"},"timestamp_utc":"2026-04-20T23:38:45Z"}
