{"duration_ms":164,"exit_status":0,"git":{"branch":"main","commit":"9b450d10b5a627ad32eeb78c6aff91b3b1601356","dirty":true},"run_id":"arb-step-typecheck-1267c0fd3f7541d18e12c11543cce34e","schema":"gzkit.arb.step_receipt.v1","stderr_tail":"","stderr_truncated":false,"stdout_tail":"All checks passed!\n","stdout_truncated":false,"step":{"command":["uv","run","ty","check","src"],"name":"typecheck"},"timestamp_utc":"2026-04-26T08:35:46Z"}
