{"duration_ms":32645,"exit_status":0,"git":{"branch":"main","commit":"52079e1a3b0803655a2bf0932fcfb643dfde4bf5","dirty":true},"run_id":"arb-step-unittest-2c1469b20289430a9bdfbeb296e10f1b","schema":"gzkit.arb.step_receipt.v1","stderr_tail":"----------------------------------------------------------------------\nRan 3855 tests in 32.099s\n\nOK (skipped=1)\n","stderr_truncated":false,"stdout_tail":"Chores registry diff:\n  + agents-md-architectural-boundaries\n  + arb-pattern-extraction\n  + cli-contract-governance\n  + complexity-reduction-xenon\n  + config-paths-remediation\n  + control-surface-rule-conflicts\n  + control-surface-rule-vs-check-drift\n  + control-surface-skill-rule-reachability\n  + coverage-40pct\n  + cross-platform-test-cleanup\n  + dependency-currency\n  + doc-coverage\n  + evidence-integrity-audit\n  + exceptions-and-logging-rationalization\n  + frontmatter-ledger-coherence\n  + hardcoded-root-eradication\n  + instructions-files-diet\n  + memory-hygiene\n  + module-sloc-cap-radon\n  + pep257-docstring-compliance\n  + pool-triage\n  + pythonic-design-pattern-application\n  + pythonic-design-pattern-detection\n  + pythonic-refactoring\n  + quality-check\n  + repository-structure-normalization\n  + schema-and-config-drift-audit\n  + skill-authoring-quality\n  + skill-command-doc-parity\n  + skill-manifest-sync\n  + skill-trigger-testing\n  + sync-manpage-docstrings\n  + test-isolation-compliance\n  + test-manpage-examples\n  + validate-manpages\n  = only-local (local-only, preserved)\nChores registry diff:\n  + agents-md-architectural-boundaries\n  + arb-pattern-extraction\n  + cli-contract-governance\n  + complexity-reduction-xenon\n  + config-paths-remediation\n  + control-surface-rule-conflicts\n  + control-surface-rule-vs-check-drift\n  + control-surface-skill-rule-reachability\n  + coverage-40pct\n  + cross-platform-test-cleanup\n  + dependency-currency\n  + doc-coverage\n  + evidence-integrity-audit\n  + exceptions-and-logging-rationalization\n  + frontmatter-ledger-coherence\n  + hardcoded-root-eradication\n  + instructions-files-diet\n  + memory-hygiene\n  + module-sloc-cap-radon\n  + pep257-docstring-compliance\n  + pool-triage\n  + pythonic-design-pattern-application\n  + pythonic-design-pattern-detection\n  + pythonic-refactoring\n  + quality-check\n  + repository-structure-normalization\n  + schema-and-config-drift-audit\n  + skill-authoring-quality\n  + skill-command-doc-parity\n  + skill-manifest-sync\n  + skill-trigger-testing\n  + sync-manpage-docstrings\n  + test-isolation-compliance\n  + test-manpage-examples\n  + validate-manpages\n  = only-local-slug (local-only, preserved)\nChores registry diff:\n  + agents-md-architectural-boundaries\n  + arb-pattern-extraction\n  + cli-contract-governance\n  + complexity-reduction-xenon\n  + config-paths-remediation\n  + control-surface-rule-conflicts\n  + control-surface-rule-vs-check-drift\n  + control-surface-skill-rule-reachability\n  + coverage-40pct\n  + cross-platform-test-cleanup\n  + dependency-currency\n  + doc-coverage\n  + evidence-integrity-audit\n  + exceptions-and-logging-rationalization\n  + frontmatter-ledger-coherence\n  + hardcoded-root-eradication\n  + instructions-files-diet\n  + memory-hygiene\n  + module-sloc-cap-radon\n  + pep257-docstring-compliance\n  + pool-triage\n  + pythonic-design-pattern-application\n  + pythonic-design-pattern-detection\n  + pythonic-refactoring\n  + quality-check\n  + repository-structure-normalization\n  + schema-and-config-drift-audit\n  + skill-authoring-quality\n  + skill-command-doc-parity\n  + skill-manifest-sync\n  + skill-trigger-testing\n  + sync-manpage-docstrings\n  + test-isolation-compliance\n  + test-manpage-examples\n  + validate-manpages\n  = only-local (local-only, preserved)\n","stdout_truncated":false,"step":{"command":["uv","run","-m","unittest","-q"],"name":"unittest"},"timestamp_utc":"2026-05-02T09:02:53Z"}
