{"duration_ms":1475,"exit_status":0,"git":{"branch":"main","commit":"2cea96e88e4fb907d56f14cc186f91184b888c22","dirty":true},"run_id":"arb-step-unittest-chores-7d52e2bb89b340de95909c726e588c4d","schema":"gzkit.arb.step_receipt.v1","stderr_tail":"test_chore_resolver_falls_back_to_package (tests.commands.test_chores.TestChoreResolver.test_chore_resolver_falls_back_to_package)\nNo project tree \u2192 resolver returns the package path and logs the fallback. ... ok\ntest_chore_resolver_project_wins (tests.commands.test_chores.TestChoreResolver.test_chore_resolver_project_wins)\nProject-local chore directory wins over any package fallback. ... ok\ntest_chore_resolver_raises_with_both_paths_named (tests.commands.test_chores.TestChoreResolver.test_chore_resolver_raises_with_both_paths_named)\nBoth paths miss \u2192 GzCliError names project AND importlib.resources/gzkit.chores. ... ok\ntest_chores_list_default_no_source_column (tests.commands.test_chores.TestChoreResolver.test_chores_list_default_no_source_column)\nDefault `gz chores list` (no --explain) keeps the pre-OBPI column shape. ... ok\ntest_gz_chores_list_explain_distinguishes_source (tests.commands.test_chores.TestChoreResolver.test_gz_chores_list_explain_distinguishes_source)\n`gz chores list --explain` labels each row with project / package / missing. ... ok\ntest_registry_resolver_uses_same_order (tests.commands.test_chores.TestChoreResolver.test_registry_resolver_uses_same_order)\n`_resolve_registry()` falls back to the package registry and logs the hit. ... ok\ntest_resolved_path_model_is_well_typed (tests.commands.test_chores.TestChoreResolver.test_resolved_path_model_is_well_typed)\n`ResolvedPath` is a frozen Pydantic model with a constrained `source`. ... ok\ntest_chores_audit_reports_log_presence (tests.commands.test_chores.TestChoresCommands.test_chores_audit_reports_log_presence)\nchore audit reports log status per chore. ... ok\ntest_chores_list_reads_registry (tests.commands.test_chores.TestChoresCommands.test_chores_list_reads_registry)\nchores list prints configured chores from v2.0 registry. ... ok\ntest_chores_plan_unknown_slug_shows_blockers (tests.commands.test_chores.TestChoresCommands.test_chores_plan_unknown_slug_shows_blockers)\nchores plan fails closed when slug resolves to neither project nor package. ... ok\ntest_chores_rejects_missing_acceptance_json (tests.commands.test_chores.TestChoresCommands.test_chores_rejects_missing_acceptance_json)\nRegistry loader fails when a chore dir has no acceptance.json witness. ... ok\ntest_chores_rejects_shell_operators_in_criteria (tests.commands.test_chores.TestChoresCommands.test_chores_rejects_shell_operators_in_criteria)\nAcceptance criteria reject commands with shell operators. ... ok\ntest_chores_rejects_v1_schema (tests.commands.test_chores.TestChoresCommands.test_chores_rejects_v1_schema)\nRegistry loader rejects v1 schema format. ... ok\ntest_chores_run_executes_criteria_and_writes_log (tests.commands.test_chores.TestChoresCommands.test_chores_run_executes_criteria_and_writes_log)\nchore run executes acceptance criteria and writes log. ... ok\ntest_chores_run_missing_executable (tests.commands.test_chores.TestChoresCommands.test_chores_run_missing_executable)\nchore run fails closed when criterion executable is missing. ... ok\ntest_chores_run_nonzero_exit_returns_nonzero (tests.commands.test_chores.TestChoresCommands.test_chores_run_nonzero_exit_returns_nonzero)\nchore run fails when criterion exit code doesn't match expected. ... ok\ntest_chores_run_timeout_returns_nonzero (tests.commands.test_chores.TestChoresCommands.test_chores_run_timeout_returns_nonzero)\nchore run returns non-zero for timed out criterion. ... ok\ntest_chores_supports_medium_lane (tests.commands.test_chores.TestChoresCommands.test_chores_supports_medium_lane)\nMedium lane chores are accepted by the registry loader. ... ok\ntest_chores_vendor_field_parsed_and_displayed (tests.commands.test_chores.TestChoresCommands.test_chores_vendor_field_parsed_and_displayed)\nVendor field is parsed from registry and shown in list output. ... ok\ntest_chores_vendor_filtered_when_no_harness (tests.commands.test_chores.TestChoresCommands.test_chores_vendor_filtered_when_no_harness)\nVendor-scoped chores are hidden when harness is not active. ... ok\ntest_fileExists_missing_path_reports_blocker (tests.commands.test_chores.TestChoresFileExistsCriterion.test_fileExists_missing_path_reports_blocker)\nacceptance.json with type=fileExists but no path fails parse with blocker. ... ok\ntest_fileExists_parses_without_command (tests.commands.test_chores.TestChoresFileExistsCriterion.test_fileExists_parses_without_command)\nacceptance.json with type=fileExists and path parses without requiring command. ... ok\ntest_fileExists_run_fails_when_file_missing (tests.commands.test_chores.TestChoresFileExistsCriterion.test_fileExists_run_fails_when_file_missing)\nchore run with fileExists criterion fails when the target file is missing. ... ok\ntest_fileExists_run_passes_when_file_present (tests.commands.test_chores.TestChoresFileExistsCriterion.test_fileExists_run_passes_when_file_present)\nchore run with fileExists criterion passes when the target file exists. ... ok\ntest_dry_run_is_idempotent_after_reconcile (tests.chores.test_frontmatter_coherence_backfill.TestStructuralBackfillInvariants.test_dry_run_is_idempotent_after_reconcile)\nREQ-05: a post-reconcile dry-run rewrites zero files. ... ok\ntest_validator_clean_after_reconcile (tests.chores.test_frontmatter_coherence_backfill.TestStructuralBackfillInvariants.test_validator_clean_after_reconcile)\nREQ-04: after reconcile, the validator has no active-surface errors. ... ok\n\n----------------------------------------------------------------------\nRan 26 tests in 1.167s\n\nOK\n","stderr_truncated":false,"stdout_tail":"","stdout_truncated":false,"step":{"command":["uv","run","-m","unittest","tests.commands.test_chores","tests.chores.test_frontmatter_coherence_backfill","-v"],"name":"unittest-chores"},"timestamp_utc":"2026-04-25T12:59:09Z"}
