{"duration_ms":323,"exit_status":1,"git":{"branch":"main","commit":"fa747deb1f70c93ee1c5300cca8491153fc19cb7","dirty":true},"run_id":"arb-step-validate-surfaces-9b2af77a08d74bbea604abc1b98bb9fa","schema":"gzkit.arb.step_receipt.v1","stderr_tail":"","stderr_truncated":false,"stdout_tail":"Validated: surfaces\n\n\u274c Validation failed with 16 error(s):\n\n   \u2192  \n/Users/jeff/Documents/Code/gzkit/.github/instructions/adr_audit.instructions.md\n    Instruction frontmatter: Field required\n    Field: applyTo\n\n   \u2192  \n/Users/jeff/Documents/Code/gzkit/.github/instructions/agent_failure_modes.instru\nctions.md\n    Instruction frontmatter: Field required\n    Field: applyTo\n\n   \u2192  \n/Users/jeff/Documents/Code/gzkit/.github/instructions/brief_heading_conventions.\ninstructions.md\n    Instruction frontmatter: Field required\n    Field: applyTo\n\n   \u2192  \n/Users/jeff/Documents/Code/gzkit/.github/instructions/chores.instructions.md\n    Instruction frontmatter: Field required\n    Field: applyTo\n\n   \u2192  /Users/jeff/Documents/Code/gzkit/.github/instructions/cli.instructions.md\n    Instruction frontmatter: Field required\n    Field: applyTo\n\n   \u2192  \n/Users/jeff/Documents/Code/gzkit/.github/instructions/cross_platform.instruction\ns.md\n    Instruction frontmatter: Field required\n    Field: applyTo\n\n   \u2192  \n/Users/jeff/Documents/Code/gzkit/.github/instructions/gate5_runbook_code_covenan\nt.instructions.md\n    Instruction frontmatter: Field required\n    Field: applyTo\n\n   \u2192  \n/Users/jeff/Documents/Code/gzkit/.github/instructions/gh_cli.instructions.md\n    Instruction frontmatter: Field required\n    Field: applyTo\n\n   \u2192  \n/Users/jeff/Documents/Code/gzkit/.github/instructions/governance_core.instructio\nns.md\n    Instruction frontmatter: Field required\n    Field: applyTo\n\n   \u2192  \n/Users/jeff/Documents/Code/gzkit/.github/instructions/models.instructions.md\n    Instruction frontmatter: Field required\n    Field: applyTo\n\n   \u2192  \n/Users/jeff/Documents/Code/gzkit/.github/instructions/pythonic.instructions.md\n    Instruction frontmatter: Field required\n    Field: applyTo\n\n   \u2192  \n/Users/jeff/Documents/Code/gzkit/.github/instructions/security_sensitivity.instr\nuctions.md\n    Instruction frontmatter: Field required\n    Field: applyTo\n\n   \u2192  \n/Users/jeff/Documents/Code/gzkit/.github/instructions/skill_surface_sync.instruc\ntions.md\n    Instruction frontmatter: Field required\n    Field: applyTo\n\n   \u2192  \n/Users/jeff/Documents/Code/gzkit/.github/instructions/tests.instructions.md\n    Instruction frontmatter: Field required\n    Field: applyTo\n\n   \u2192  \n/Users/jeff/Documents/Code/gzkit/.github/instructions/tool_skill_runbook_alignme\nnt.instructions.md\n    Instruction frontmatter: Field required\n    Field: applyTo\n\n   \u2192  rule-placement\n    skill_surface_sync.instructions.md: shared subtree rule for \n'.github/instructions' has no nested AGENTS.md\n\n","stdout_truncated":false,"step":{"command":["uv","run","gz","validate","--surfaces"],"name":"validate-surfaces"},"timestamp_utc":"2026-04-30T09:09:41Z"}
