{"duration_ms":446,"exit_status":0,"git":{"branch":"main","commit":"d10fc22c0cd73b4e879d055a68675037028e1e5d","dirty":true},"run_id":"arb-step-unittest-ae0825d9d70544b696cc8e06bf91b13c","schema":"gzkit.arb.step_receipt.v1","stderr_tail":"","stderr_truncated":false,"stdout_tail":"No @covers unit tests found for OBPI-0.26.0-11-artifacts-lib.\n","stdout_truncated":false,"step":{"command":["uv","run","gz","test","--obpi","OBPI-0.26.0-11-artifacts-lib"],"name":"unittest"},"timestamp_utc":"2026-05-02T00:52:14Z"}
