{"duration_ms":764,"exit_status":0,"git":{"branch":"main","commit":"e0e59828e2278b6df0ef045669f23dc883466163","dirty":true},"run_id":"arb-step-typecheck-a322e40230894224be3b0a79a3aa9aa2","schema":"gzkit.arb.step_receipt.v1","stderr_tail":"","stderr_truncated":false,"stdout_tail":"All checks passed!\n","stdout_truncated":false,"step":{"command":["uv","run","ty","check","src"],"name":"typecheck"},"timestamp_utc":"2026-04-18T18:04:44Z"}
