{"duration_ms":2575,"exit_status":0,"git":{"branch":"main","commit":"757550944e0ab32d9ff7f45ee0091368609c4a4b","dirty":true},"run_id":"arb-step-mkdocs-5a8547a482654d04a76bdac1fa6fa925","schema":"gzkit.arb.step_receipt.v1","stderr_tail":"rface-parity.md\n  - drafts/sprint-and-drift-harness-governance.md\n  - examples/presentations/index.md\n  - examples/presentations/complete-series-script.md\n  - examples/presentations/part1-script.md\n  - examples/presentations/part2-script.md\n  - examples/presentations/part3-script.md\n  - examples/presentations/part4-script.md\n  - examples/presentations/part5-script.md\n  - examples/presentations/part6-script.md\n  - examples/templates/req-template.md\n  - governance/AGENTS.md\n  - governance/advisory-rules-audit.md\n  - governance/agent-contract-rationale.md\n  - governance/agent-control-surface-fidelity-doctrine.md\n  - governance/agent-control-surface-rendering-substrate.md\n  - governance/ai-governance-brief.md\n  - governance/ai-governance-research-gaps.md\n  - governance/ai-governance-research-literature.md\n  - governance/ai-governance-research-practice.md\n  - governance/ai-governance-research-regulation.md\n  - governance/ai-governance-verification.md\n  - governance/ai-governance.md\n  - governance/ai-governance.provenance.md\n  - governance/arb-middleware.md\n  - governance/cross-platform-rationale.md\n  - governance/defect-fix-routing.md\n  - governance/harness-engineering-appraisal.md\n  - governance/layer-three-derived-views.md\n  - governance/model-regression-taxonomy.md\n  - governance/operator-economy.md\n  - governance/opus-tuning.md\n  - governance/security-sensitivity-rationale.md\n  - governance/tests-rationale.md\n  - governance/token-block-doctrine.md\n  - governance/tool-skill-runbook-rationale.md\n  - governance/trust-doctrine.md\n  - governance/GovZero/obpi-pipeline-runbook.md\n  - governance/complexity/AGENTS.md\n  - governance/complexity/complexity-doctrine-rationale.md\n  - governance/complexity/complexity-thresholds-rationale.md\n  - governance/complexity/distilled-characteristics-2026-05-04.md\n  - governance/complexity/baselines/2026-05-04/baseline.summary.md\n  - governance/research_sources/0900001680afb122.md\n  - governance/research_sources/1-introduction-the-imperative-of-public-values-in-ai.md\n  - governance/research_sources/1680afaeba.md\n  - governance/research_sources/a-closer-look-at-the-existing-risks-of-generative-ai-mapping-the-who-what-and-how-of-real-world-inci.md\n  - governance/research_sources/advancing-accountability-in-ai-en.md\n  - governance/research_sources/ai-risk-management-framework-japanese-translation.md\n  - governance/research_sources/anthropics-responsible-scaling-policy-version-30.md\n  - governance/research_sources/artificial-intelligence-risk-management-framework-ai-rmf-10.md\n  - governance/research_sources/artificial-intelligence-risk-management-framework-generative-artificial-intelligence-profile.md\n  - governance/research_sources/arxiv-240614713.md\n  - governance/research_sources/arxiv-240714981.md\n  - governance/research_sources/auditing-work-exploring-the-new-york-city-algorithmic-bias-audit-regime.md\n  - governance/research_sources/claude-4-system-card.md\n  - governance/research_sources/hai-ai-index-report-2025-chapter3-final.md\n  - governance/research_sources/hls20white20paper20final-v3.md\n  - governance/research_sources/introducing-the-oecd-ai-capability-indicators-en.md\n  - governance/research_sources/m-24-10-advancing-governance-innovation-and-risk-management-for-agency-use-of-artificial-intelligenc.md\n  - governance/research_sources/m-25-21-accelerating-federal-use-of-ai-through-innovation-governance-and-public-trust.md\n  - governance/research_sources/m-25-22-driving-efficient-acquisition-of-artificial-intelligence-in-government.md\n  - governance/research_sources/microsoft-word-ai-governance-tiimalasipaperi-arxivdocx.md\n  - governance/research_sources/nistai600-1genai-profileipd.md\n  - governance/research_sources/operator-system-card.md\n  - governance/research_sources/preparedness-framework-v2.md\n  - governance/research_sources/quantifying-detection-rates.md\n  - governance/research_sources/responsible-ai-governance-a-systematic-literature-review.md\n  - governance/research_sources/responsible-ai-governance-in-the-public-sector-explaining-contextual-dynamics-through-a-realist-synt.md\n  - governance/research_sources/responsible-use-guide.md\n  - governance/research_sources/steering-ais-future-en.md\n  - governance/research_sources/the-bureaucratic-challenge-to-ai-governance-an-empirical-assessment-of-implementation-at-us-federal.md\n  - governance/research_sources/the-governance-of-ai-companies-reconciling-purpose-with-profits.md\n  - harness-docs/GZK-GOV-007-ultrareview-and-gate-5.md\n  - harness-docs/expanding-the-bitter-lesson-for-agentic-software-development.md\n  - harness-docs/xhigh-measurement-protocol.md\n  - releases/PATCH-v0.24.3.md\n  - releases/PATCH-v0.25.10.md\n  - releases/PATCH-v0.25.11.md\n  - releases/PATCH-v0.25.12.md\n  - releases/PATCH-v0.25.13.md\n  - releases/PATCH-v0.25.14.md\n  - releases/PATCH-v0.25.15.md\n  - releases/PATCH-v0.25.16.md\n  - releases/PATCH-v0.25.17.md\n  - releases/PATCH-v0.25.18.md\n  - releases/PATCH-v0.25.19.md\n  - releases/PATCH-v0.25.7.md\n  - releases/PATCH-v0.25.8.md\n  - releases/PATCH-v0.25.9.md\n  - releases/PATCH-v0.26.0.md\n  - releases/PATCH-v0.26.1.md\n  - superpowers/plans/2026-03-26-pipeline-reliability-improvements.md\n  - superpowers/specs/2026-03-26-pipeline-reliability-improvements-design.md\n  - user/commands/adr-evaluate.md\n  - user/commands/adr-report.md\n  - user/commands/arb-advise.md\n  - user/commands/arb-coverage.md\n  - user/commands/arb-patterns.md\n  - user/commands/arb-ruff.md\n  - user/commands/arb-step.md\n  - user/commands/arb-ty.md\n  - user/commands/arb-typecheck.md\n  - user/commands/arb-validate.md\n  - user/commands/arb.md\n  - user/commands/check.md\n  - user/commands/chores-advise.md\n  - user/commands/chores-doctor.md\n  - user/commands/chores-propose-ghi.md\n  - user/commands/chores-show.md\n  - user/commands/complexity-advise.md\n  - user/commands/complexity-distill.md\n  - user/commands/drift.md\n  - user/commands/format.md\n  - user/commands/frontmatter-reconcile.md\n  - user/commands/interview.md\n  - user/commands/issue-file.md\n  - user/commands/justify.md\n  - user/commands/lint.md\n  - user/commands/obpi-audit.md\n  - user/commands/obpi-complete.md\n  - user/commands/obpi-lock-check.md\n  - user/commands/obpi-lock-claim.md\n  - user/commands/obpi-lock-list.md\n  - user/commands/obpi-lock-release.md\n  - user/commands/obpi-lock-status.md\n  - user/commands/obpi-withdraw.md\n  - user/commands/personas-drift.md\n  - user/commands/plan.md\n  - user/commands/preflight.md\n  - user/commands/readiness-evaluate.md\n  - user/commands/roles.md\n  - user/commands/skill-list.md\n  - user/commands/skill-new.md\n  - user/commands/test.md\n  - user/commands/tidy.md\n  - user/commands/typecheck.md\n  - user/commands/validate.md\n  - user/concepts/reporter-architecture.md\n  - user/concepts/subagent-pipeline.md\n  - user/concepts/task-overview.md\n  - user/manpages/arb.md\n  - user/manpages/closeout.md\n  - user/manpages/gz-adr-audit-check.md\n  - user/manpages/gz-chores.md\n  - user/manpages/gz-complexity-advise.md\n  - user/manpages/gz-issue.md\n  - user/manpages/gz-justify.md\n  - user/manpages/gz-personas.md\n  - user/manpages/gz-validate.md\n  - user/manpages/patch-release.md\n  - user/skills/_TEMPLATE.md\n  - user/skills/airlineops-parity-scan.md\n  - user/skills/ghi-author.md\n  - user/skills/ghi-close.md\n  - user/skills/ghi-triage.md\n  - user/skills/gz-adr-autolink.md\n  - user/skills/gz-adr-promote.md\n  - user/skills/gz-adr-recon.md\n  - user/skills/gz-adr-sync.md\n  - user/skills/gz-agent-sync.md\n  - user/skills/gz-check-config-paths.md\n  - user/skills/gz-competitor-radar.md\n  - user/skills/gz-complexity-distill.md\n  - user/skills/gz-context-diet.md\n  - user/skills/gz-deps-upgrade.md\n  - user/skills/gz-issue-file.md\n  - user/skills/gz-justify.md\n  - user/skills/gz-migrate-semver.md\n  - user/skills/gz-pythonic-pattern-apply.md\n  - user/skills/gz-pythonic-pattern-detect.md\n  - user/skills/gz-skill-router.md\n  - user/skills/gz-tech-debt-review.md\n  - user/skills/gz-tidy.md\nINFO    -  Documentation built in 2.44 seconds\n","stderr_truncated":true,"stdout_tail":"","stdout_truncated":false,"step":{"command":["uv","run","mkdocs","build","--strict"],"name":"mkdocs"},"timestamp_utc":"2026-05-08T07:52:35Z"}
