{"duration_ms":190,"exit_status":0,"git":{"branch":"main","commit":"e228f99d43b1570b58f40e129df529cb3995f7db","dirty":true},"run_id":"arb-step-typecheck-4ffa1a817f2a475c8caf7553a9b37194","schema":"gzkit.arb.step_receipt.v1","stderr_tail":"","stderr_truncated":false,"stdout_tail":"All checks passed!\n","stdout_truncated":false,"step":{"command":["uv","run","ty","check","src"],"name":"typecheck"},"timestamp_utc":"2026-04-19T14:19:28Z"}
