{"duration_ms":138,"exit_status":0,"git":{"branch":"main","commit":"d95cb7987b4c297b5a548a03a890da9ce87dea8f","dirty":true},"run_id":"arb-step-typecheck-071e6a632455489b9d8e846b6d7b35b2","schema":"gzkit.arb.step_receipt.v1","stderr_tail":"","stderr_truncated":false,"stdout_tail":"All checks passed!\n","stdout_truncated":false,"step":{"command":["uv","run","ty","check","src"],"name":"typecheck"},"timestamp_utc":"2026-04-29T12:35:27Z"}
