{"duration_ms":638,"exit_status":0,"git":{"branch":"main","commit":"fa463e5c9cdab51b669ee034263e4b3a020519f0","dirty":true},"run_id":"arb-step-typecheck-448f22de07444e2996c6ddb930ec6784","schema":"gzkit.arb.step_receipt.v1","stderr_tail":"","stderr_truncated":false,"stdout_tail":"All checks passed!\n","stdout_truncated":false,"step":{"command":["uv","run","ty","check","src"],"name":"typecheck"},"timestamp_utc":"2026-05-05T23:33:20Z"}
