{"duration_ms":177,"exit_status":0,"git":{"branch":"main","commit":"f84ef34dadfa3092a71b73c0eb029db6523b13af","dirty":true},"run_id":"arb-step-typecheck-e76a14f27cf24a5d87f2dd4bd14e29bf","schema":"gzkit.arb.step_receipt.v1","stderr_tail":"","stderr_truncated":false,"stdout_tail":"All checks passed!\n","stdout_truncated":false,"step":{"command":["uv","run","ty","check","src"],"name":"typecheck"},"timestamp_utc":"2026-04-29T07:43:26Z"}
