{"duration_ms":162,"exit_status":0,"git":{"branch":"main","commit":"87dc6cdd3782dcfab92fa16291e440c883f1e97b","dirty":true},"run_id":"arb-step-typecheck-1fa045beb5c74a3e8f980091da9d6772","schema":"gzkit.arb.step_receipt.v1","stderr_tail":"","stderr_truncated":false,"stdout_tail":"All checks passed!\n","stdout_truncated":false,"step":{"command":["uv","run","ty","check","src"],"name":"typecheck"},"timestamp_utc":"2026-04-25T11:09:15Z"}
