{"duration_ms":32040,"exit_status":0,"git":{"branch":"main","commit":"5b0424fd2cf81b1a02713ae2e485ed6b588a1666","dirty":true},"run_id":"arb-step-unittest-e4aa649c9fd94e18bc0515edec48adff","schema":"gzkit.arb.step_receipt.v1","stderr_tail":"Skipping unparseable file: /var/folders/7y/cvcpqqnj2_52yy4wl780kmqc0000gn/T/tmpk2ik4t1q/test_broken.py\nMalformed REQ line (skipped): - [ ] REQ-X-Y-Z: Malformed (non-numeric).\nMalformed REQ line (skipped): - [ ] REQ-: Empty body.\n----------------------------------------------------------------------\nRan 3984 tests in 31.633s\n\nOK (skipped=1)\n","stderr_truncated":false,"stdout_tail":"Error: Attestation receipt-binding gate failed (heavy/foundation policy).\n  - missing: no receipt file at \narb-step-unittest-dddddddddddddddddddddddddddddddd.json\nRecovery: re-run the cited ARB commands and re-cite the resolved receipt IDs.\nError: ADR closeout blocked \u2014 unwaived REQ coverage gaps in ADR-9.9.9-fixture:\n  OBPI-9.9.9-99-fixture: REQ-9.9.9-99-01\nWaive each gap with `gz obpi complete --accept-uncovered <REQ-ID> \n--accept-uncovered-reason <REASON>` before closing the ADR.\nADR closeout receipt emitted.\n  ADR: ADR-9.9.9-fixture\n  Event: closed\nADR closeout receipt emitted.\n  ADR: ADR-9.9.9-fixture\n  Event: closed\nChores registry diff:\n  + agents-md-architectural-boundaries\n  + arb-pattern-extraction\n  + cli-contract-governance\n  + complexity-reduction-xenon\n  + config-paths-remediation\n  + control-surface-rule-conflicts\n  + control-surface-rule-vs-check-drift\n  + control-surface-skill-rule-reachability\n  + coverage-40pct\n  + cross-platform-test-cleanup\n  + dependency-currency\n  + doc-coverage\n  + evidence-integrity-audit\n  + exceptions-and-logging-rationalization\n  + frontmatter-ledger-coherence\n  + hardcoded-root-eradication\n  + instructions-files-diet\n  + memory-hygiene\n  + module-sloc-cap-radon\n  + pep257-docstring-compliance\n  + pool-triage\n  + pythonic-design-pattern-application\n  + pythonic-design-pattern-detection\n  + pythonic-refactoring\n  + quality-check\n  + repository-structure-normalization\n  + schema-and-config-drift-audit\n  + skill-authoring-quality\n  + skill-command-doc-parity\n  + skill-manifest-sync\n  + skill-trigger-testing\n  + sync-manpage-docstrings\n  + test-isolation-compliance\n  + test-manpage-examples\n  + validate-manpages\n  = only-local (local-only, preserved)\nChores registry diff:\n  + agents-md-architectural-boundaries\n  + arb-pattern-extraction\n  + cli-contract-governance\n  + complexity-reduction-xenon\n  + config-paths-remediation\n  + control-surface-rule-conflicts\n  + control-surface-rule-vs-check-drift\n  + control-surface-skill-rule-reachability\n  + coverage-40pct\n  + cross-platform-test-cleanup\n  + dependency-currency\n  + doc-coverage\n  + evidence-integrity-audit\n  + exceptions-and-logging-rationalization\n  + frontmatter-ledger-coherence\n  + hardcoded-root-eradication\n  + instructions-files-diet\n  + memory-hygiene\n  + module-sloc-cap-radon\n  + pep257-docstring-compliance\n  + pool-triage\n  + pythonic-design-pattern-application\n  + pythonic-design-pattern-detection\n  + pythonic-refactoring\n  + quality-check\n  + repository-structure-normalization\n  + schema-and-config-drift-audit\n  + skill-authoring-quality\n  + skill-command-doc-parity\n  + skill-manifest-sync\n  + skill-trigger-testing\n  + sync-manpage-docstrings\n  + test-isolation-compliance\n  + test-manpage-examples\n  + validate-manpages\n  = only-local-slug (local-only, preserved)\nChores registry diff:\n  + agents-md-architectural-boundaries\n  + arb-pattern-extraction\n  + cli-contract-governance\n  + complexity-reduction-xenon\n  + config-paths-remediation\n  + control-surface-rule-conflicts\n  + control-surface-rule-vs-check-drift\n  + control-surface-skill-rule-reachability\n  + coverage-40pct\n  + cross-platform-test-cleanup\n  + dependency-currency\n  + doc-coverage\n  + evidence-integrity-audit\n  + exceptions-and-logging-rationalization\n  + frontmatter-ledger-coherence\n  + hardcoded-root-eradication\n  + instructions-files-diet\n  + memory-hygiene\n  + module-sloc-cap-radon\n  + pep257-docstring-compliance\n  + pool-triage\n  + pythonic-design-pattern-application\n  + pythonic-design-pattern-detection\n  + pythonic-refactoring\n  + quality-check\n  + repository-structure-normalization\n  + schema-and-config-drift-audit\n  + skill-authoring-quality\n  + skill-command-doc-parity\n  + skill-manifest-sync\n  + skill-trigger-testing\n  + sync-manpage-docstrings\n  + test-isolation-compliance\n  + test-manpage-examples\n  + validate-manpages\n  = only-local (local-only, preserved)\nADR audit-check: ADR-0.0.23\nPASS All linked OBPIs are completed with evidence.\n\nCoverage: No REQs found for this ADR.\nADR audit-check: ADR-0.1.0\nPASS All linked OBPIs are completed with evidence.\n\nCoverage: No REQs found for this ADR.\nADR audit-check: ADR-0.1.0\nPASS All linked OBPIs are completed with evidence.\n\nCoverage: No REQs found for this ADR.\nADR audit-check: ADR-0.1.0\nPASS All linked OBPIs are completed with evidence.\n\nCoverage: No REQs found for this ADR.\nADR audit-check: ADR-0.1.0\nPASS All linked OBPIs are completed with evidence.\n\nCoverage: No REQs found for this ADR.\nBackfill 1 covers-backfill warning(s):\n  tests/x.py:1 REQ REQ-0.1.0-01-01 introduced @ aaaaaaa (0c / 0d before receipt \nr1); see .claude/rules/tests.md \u00a7 Invariant 6f for remediation\nADR audit-check: ADR-0.1.0\nPASS All linked OBPIs are completed with evidence.\n\nCoverage: No REQs found for this ADR.\nUnresolvable 1 covers-backfill location(s) not resolvable in git:\n  tests/x.py:1 unresolvable\nADR audit-check: ADR-0.1.0\nPASS All linked OBPIs are completed with evidence.\n\nCoverage: No REQs found for this ADR.\nFAIL 1 covers-backfill finding(s):\n  tests/x.py:1 REQ REQ-0.1.0-01-01 introduced @ aaaaaaa (0c / 0d before receipt \nr1); see .claude/rules/tests.md \u00a7 Invariant 6f for remediation\n","stdout_truncated":false,"step":{"command":["uv","run","-m","unittest","-q"],"name":"unittest"},"timestamp_utc":"2026-05-03T06:51:53Z"}
