{"duration_ms":160,"exit_status":0,"git":{"branch":"main","commit":"c75e3bceb0ed409ca3bde7d763d119b61d7d2039","dirty":true},"run_id":"arb-step-typecheck-1e69c2143e2b40e095c5f6d9e3e77746","schema":"gzkit.arb.step_receipt.v1","stderr_tail":"","stderr_truncated":false,"stdout_tail":"All checks passed!\n","stdout_truncated":false,"step":{"command":["uv","run","ty","check","src"],"name":"typecheck"},"timestamp_utc":"2026-04-21T00:37:36Z"}
