{"duration_ms":170,"exit_status":0,"git":{"branch":"main","commit":"c99229896f5b5e2f285212c07a030543ec1220f8","dirty":true},"run_id":"arb-step-typecheck-01d802ce1c1d417dbc4156277dd6a18d","schema":"gzkit.arb.step_receipt.v1","stderr_tail":"","stderr_truncated":false,"stdout_tail":"All checks passed!\n","stdout_truncated":false,"step":{"command":["uv","run","ty","check","src"],"name":"typecheck"},"timestamp_utc":"2026-04-21T11:03:50Z"}
