{"duration_ms":113060,"exit_status":1,"git":{"branch":"main","commit":"770f4b699e280c3abd398d74a66f59e427a6daff","dirty":true},"run_id":"arb-step-coverage-bf015e9e4888415da1dee9ed70573a17","schema":"gzkit.arb.step_receipt.v1","stderr_tail":".......................................................................................................................................arb: invalid step invocation: ARB step name is required\n.......................................................................................................................................................................................................................................................................................................................................................F....................................................................................................................................................................................................................................................................................................................................................................................................................................................................................................................................................................................................................................................................................................................................................................................................................................................................................................................................................................................................................................................................................................................................................................................................................................................................................................................................................................................................................................................................................................................................................................................................................................................................................................................................................................................................................................................................................................................................................................................................................................................................................................................................................................................................................................................................................................................................................................................................................................................................................................................................................................................................................................................................................................................................................................................................................................\n======================================================================\nFAIL: test_runtime_budget_under_one_second_on_real_repo (tests.commands.test_validate_frontmatter.TestFrontmatterGuard.test_runtime_budget_under_one_second_on_real_repo)\nReal repo runtime < 1.0s (~80 ADRs / ~200 OBPIs scale).\n----------------------------------------------------------------------\nTraceback (most recent call last):\n  File \"C:\\Users\\Jeff\\source\\repos\\va\\gzkit\\tests\\commands\\test_validate_frontmatter.py\", line 271, in test_runtime_budget_under_one_second_on_real_repo\n    self.assertLess(\n    ~~~~~~~~~~~~~~~^\n        elapsed,\n        ^^^^^^^^\n        1.0,\n        ^^^^\n        f\"Frontmatter guard exceeded 1.0s budget (took {elapsed:.2f}s)\",\n        ^^^^^^^^^^^^^^^^^^^^^^^^^^^^^^^^^^^^^^^^^^^^^^^^^^^^^^^^^^^^^^^^\n    )\n    ^\nAssertionError: 1.2090250999999625 not less than 1.0 : Frontmatter guard exceeded 1.0s budget (took 1.21s)\n\n----------------------------------------------------------------------\nRan 3203 tests in 111.386s\n\nFAILED (failures=1)\n","stderr_truncated":false,"stdout_tail":"usage: gz patch release [-h] [--dry-run] [--json] [--full] [--quiet |\n                        --verbose] [--debug]\n\nExecute the GHI-driven patch release ceremony. With --full: bump, author release notes, commit, push (with lint/test gates), and create the GitHub release as one transaction.\n\noptions:\n  -h, --help     show this help message and exit\n  --dry-run      Show planned actions without executing\n  --json         Output as JSON\n  --full         Execute the full ceremony: bump, release notes, commit, push,\n                 gh release\n  --quiet, -q    Suppress non-error output\n  --verbose, -v  Enable verbose output\n  --debug        Enable debug mode with full tracebacks\n\nExamples\n    gz patch release --dry-run\n    gz patch release --full\n    gz patch release --json\n\nExit codes\n    0   Success\n    1   User/config error\n    2   System/IO error\n    3   Policy breach\nManual edit to .gzkit/ledger.jsonl detected \ufffd ledger is append-only via gz commands (CLAUDE.md governance rule 16).\n  offending line: -{\"event\": \"x\"}\nSkill/rule sync drift detected:\n  - .gzkit/rules/new-rule.md edited without `.claude/rules/new-rule.md` / `.github/instructions/new-rule.md` mirror. Run `uv run gz agent sync control-surfaces`.\nSkill/rule sync drift detected:\n  - .gzkit/skills/foo/SKILL.md edited without `.claude/skills/foo/SKILL.md` / `.github/skills/foo/SKILL.md` mirror. Run `uv run gz agent sync control-surfaces`.\n","stdout_truncated":false,"step":{"command":["uv","run","coverage","run","-m","unittest","discover","-s","tests","-t","."],"name":"coverage"},"timestamp_utc":"2026-04-19T15:48:19Z"}