{"duration_ms":151,"exit_status":0,"git":{"branch":"main","commit":"45afc7c849c41cc38d98966b618ac1dd2d593981","dirty":true},"run_id":"arb-step-typecheck-2d7ecd4ec8a8422e89efac265cd7ed9e","schema":"gzkit.arb.step_receipt.v1","stderr_tail":"","stderr_truncated":false,"stdout_tail":"All checks passed!\n","stdout_truncated":false,"step":{"command":["uv","run","ty","check","src"],"name":"typecheck"},"timestamp_utc":"2026-05-03T00:50:13Z"}
