{"duration_ms":93987,"exit_status":1,"git":{"branch":"main","commit":"3e7129560e53fad441daaea359a4794fb4bfe79a","dirty":true},"run_id":"arb-step-unittest-046c8f94556545c1b4c25ed9993b91ba","schema":"gzkit.arb.step_receipt.v1","stderr_tail":"arb: invalid step invocation: ARB step name is required\n======================================================================\nFAIL: test_blocks_when_self_audit_subprocess_fails (tests.test_hooks.TestPlanAuditGateHook.test_blocks_when_self_audit_subprocess_fails)\nGHI #191: hook still blocks when the self-audit subprocess exits non-zero.\n----------------------------------------------------------------------\nTraceback (most recent call last):\n  File \"C:\\Users\\Jeff\\source\\repos\\va\\gzkit\\tests\\test_hooks.py\", line 831, in test_blocks_when_self_audit_subprocess_fails\n    self.assertIn(\"audit alignment gap\", result.stderr)\n    ~~~~~~~~~~~~~^^^^^^^^^^^^^^^^^^^^^^^^^^^^^^^^^^^^^^\nAssertionError: 'audit alignment gap' not found in \"plan-audit-gate: receipt no audit receipt found; self-running 'gz plan audit OBPI-0.12.0-02'...\\nBLOCKED: Cannot exit plan mode - plan audit required.\\n\\nPlan 'active.md' references: OBPI-0.12.0-02\\nReason: No audit receipt found\\n\\nSelf-audit attempt: self-audit command not found: [WinError 2] The system cannot find the file specified\\n\\nREQUIRED: Run the pre-flight alignment audit manually:\\n  /gz-plan-audit OBPI-0.12.0-02\\n\\nThis verifies ADR <-> OBPI <-> Plan alignment before implementation begins.\\n\\n\"\n\n======================================================================\nFAIL: test_blocks_when_self_audit_writes_fail_receipt (tests.test_hooks.TestPlanAuditGateHook.test_blocks_when_self_audit_writes_fail_receipt)\nGHI #191: hook blocks when self-audit succeeds but writes a FAIL verdict.\n----------------------------------------------------------------------\nTraceback (most recent call last):\n  File \"C:\\Users\\Jeff\\source\\repos\\va\\gzkit\\tests\\test_hooks.py\", line 847, in test_blocks_when_self_audit_writes_fail_receipt\n    self.assertEqual(result.returncode, 0, msg=result.stderr)\n    ~~~~~~~~~~~~~~~~^^^^^^^^^^^^^^^^^^^^^^^^^^^^^^^^^^^^^^^^^\nAssertionError: 2 != 0 : plan-audit-gate: receipt no audit receipt found; self-running 'gz plan audit OBPI-0.12.0-02'...\nBLOCKED: Cannot exit plan mode - plan audit required.\n\nPlan 'active.md' references: OBPI-0.12.0-02\nReason: No audit receipt found\n\nSelf-audit attempt: self-audit command not found: [WinError 2] The system cannot find the file specified\n\nREQUIRED: Run the pre-flight alignment audit manually:\n  /gz-plan-audit OBPI-0.12.0-02\n\nThis verifies ADR <-> OBPI <-> Plan alignment before implementation begins.\n\n\n\n======================================================================\nFAIL: test_self_audits_when_receipt_missing_and_allows_on_pass (tests.test_hooks.TestPlanAuditGateHook.test_self_audits_when_receipt_missing_and_allows_on_pass)\nGHI #191: hook self-runs gz plan audit when receipt missing; allows on PASS.\n----------------------------------------------------------------------\nTraceback (most recent call last):\n  File \"C:\\Users\\Jeff\\source\\repos\\va\\gzkit\\tests\\test_hooks.py\", line 792, in test_self_audits_when_receipt_missing_and_allows_on_pass\n    self.assertEqual(result.returncode, 0, msg=result.stderr)\n    ~~~~~~~~~~~~~~~~^^^^^^^^^^^^^^^^^^^^^^^^^^^^^^^^^^^^^^^^^\nAssertionError: 2 != 0 : plan-audit-gate: receipt no audit receipt found; self-running 'gz plan audit OBPI-0.12.0-02'...\nBLOCKED: Cannot exit plan mode - plan audit required.\n\nPlan 'active.md' references: OBPI-0.12.0-02\nReason: No audit receipt found\n\nSelf-audit attempt: self-audit command not found: [WinError 2] The system cannot find the file specified\n\nREQUIRED: Run the pre-flight alignment audit manually:\n  /gz-plan-audit OBPI-0.12.0-02\n\nThis verifies ADR <-> OBPI <-> Plan alignment before implementation begins.\n\n\n\n======================================================================\nFAIL: test_self_audits_when_receipt_obpi_mismatches_and_allows_on_pass (tests.test_hooks.TestPlanAuditGateHook.test_self_audits_when_receipt_obpi_mismatches_and_allows_on_pass)\nGHI #191: hook self-runs even when a stale receipt exists for a different OBPI.\n----------------------------------------------------------------------\nTraceback (most recent call last):\n  File \"C:\\Users\\Jeff\\source\\repos\\va\\gzkit\\tests\\test_hooks.py\", line 814, in test_self_audits_when_receipt_obpi_mismatches_and_allows_on_pass\n    self.assertEqual(result.returncode, 0, msg=result.stderr)\n    ~~~~~~~~~~~~~~~~^^^^^^^^^^^^^^^^^^^^^^^^^^^^^^^^^^^^^^^^^\nAssertionError: 2 != 0 : plan-audit-gate: receipt no audit receipt found; self-running 'gz plan audit OBPI-0.12.0-02'...\nBLOCKED: Cannot exit plan mode - plan audit required.\n\nPlan 'active.md' references: OBPI-0.12.0-02\nReason: No audit receipt found\n\nSelf-audit attempt: self-audit command not found: [WinError 2] The system cannot find the file specified\n\nREQUIRED: Run the pre-flight alignment audit manually:\n  /gz-plan-audit OBPI-0.12.0-02\n\nThis verifies ADR <-> OBPI <-> Plan alignment before implementation begins.\n\n\n\n----------------------------------------------------------------------\nRan 3189 tests in 93.151s\n\nFAILED (failures=4)\n","stderr_truncated":false,"stdout_tail":"usage: gz patch release [-h] [--dry-run] [--json] [--full] [--quiet |\n                        --verbose] [--debug]\n\nExecute the GHI-driven patch release ceremony. With --full: bump, author release notes, commit, push (with lint/test gates), and create the GitHub release as one transaction.\n\noptions:\n  -h, --help     show this help message and exit\n  --dry-run      Show planned actions without executing\n  --json         Output as JSON\n  --full         Execute the full ceremony: bump, release notes, commit, push,\n                 gh release\n  --quiet, -q    Suppress non-error output\n  --verbose, -v  Enable verbose output\n  --debug        Enable debug mode with full tracebacks\n\nExamples\n    gz patch release --dry-run\n    gz patch release --full\n    gz patch release --json\n\nExit codes\n    0   Success\n    1   User/config error\n    2   System/IO error\n    3   Policy breach\nManual edit to .gzkit/ledger.jsonl detected \ufffd ledger is append-only via gz commands (CLAUDE.md governance rule 16).\n  offending line: -{\"event\": \"x\"}\nSkill/rule sync drift detected:\n  - .gzkit/rules/new-rule.md edited without `.claude/rules/new-rule.md` / `.github/instructions/new-rule.md` mirror. Run `uv run gz agent sync control-surfaces`.\nSkill/rule sync drift detected:\n  - .gzkit/skills/foo/SKILL.md edited without `.claude/skills/foo/SKILL.md` / `.github/skills/foo/SKILL.md` mirror. Run `uv run gz agent sync control-surfaces`.\n","stdout_truncated":false,"step":{"command":["uv","run","-m","unittest","-q"],"name":"unittest"},"timestamp_utc":"2026-04-19T01:42:01Z"}
