{"duration_ms":178,"exit_status":0,"git":{"branch":"main","commit":"e87d891c45a6466e8cc3d5a8eacb3531858fb5bc","dirty":true},"run_id":"arb-step-unittest-justify-04-e0b77ce9cd9545c28f8a799ae0073a8e","schema":"gzkit.arb.step_receipt.v1","stderr_tail":"..........\n----------------------------------------------------------------------\nRan 10 tests in 0.022s\n\nOK\n","stderr_truncated":false,"stdout_tail":"","stdout_truncated":false,"step":{"command":["uv","run","-m","unittest","tests.skills.test_gz_justify_skill","tests.skills.test_skill_surface_sync_justify"],"name":"unittest-justify-04"},"timestamp_utc":"2026-04-22T09:56:05Z"}
