{"duration_ms":79859,"exit_status":0,"git":{"branch":"main","commit":"c8cc88ac046cb2161379c0f556b1a828b9684b48","dirty":true},"run_id":"arb-step-unittest-02e10a268c3a4834a3180b0952115781","schema":"gzkit.arb.step_receipt.v1","stderr_tail":"........................................................................................................................................................................................................................................................................................................................ssss..................................................................................................................................................................................................................................................................................................................................................................................................................................................................................................................................................................................................................................................................................................................................................................................................................................................................................................................................................................................................................................................................................................................................................................................................................................................................................................................................................................................................................................................................................................................................................................................................................................................................................................................................................................................................................................................................................................................................................................................................................................................................................................................................................................................................................................................................................................................................................................................................................................................................................................................................................................................................................................................................................................................................................................................................................................................................................................................................................................................................................................................................................................................................................................................................................................................................................................................................................................................................................................................................................................................................................................................................................................................................................................................................................................................................................................................................................................................................................................................................................................................................................................................................................................................................................................................................................................................................................................................................................................................................................................................................................................................................................................................................................................................................................................................................................................................................................................................................................................................................................................................................................................................................................................................................................................................................................................................................................................................................................................................................................................................................................................................................................................................................................................................................................................................................................................................................................................................................................................................................................................................................................................................................................................................................................................................................................................................................................................................................................................................................................................................................................................................................................................................................................................................................................................................................................................................................................................................................................................................................................................................................................................................................................................................................................................................................................................................................................................................................................................................................................................................................................................................................................................................................................................................................................................................................................................................................................\n----------------------------------------------------------------------\nRan 9849 tests in 79.062s\n\nOK (skipped=4)\n","stderr_truncated":true,"stdout_tail":"","stdout_truncated":false,"step":{"command":["uv","run","unittest-parallel","-t",".","-s","tests","--buffer"],"name":"unittest"},"timestamp_utc":"2026-09-07T14:19:41Z"}
