{"duration_ms":165,"exit_status":0,"git":{"branch":"main","commit":"be3b06e839df9c61e474483d4a8d23ab98149033","dirty":true},"run_id":"arb-step-typecheck-9a6e88e7dfbd479aa4e1bc1464a796e8","schema":"gzkit.arb.step_receipt.v1","stderr_tail":"","stderr_truncated":false,"stdout_tail":"All checks passed!\n","stdout_truncated":false,"step":{"command":["uv","run","ty","check","src"],"name":"typecheck"},"timestamp_utc":"2026-04-27T12:03:03Z"}
