{"duration_ms":174,"exit_status":0,"git":{"branch":"main","commit":"07ae5058ec10c4f3e53bc0261b7ec2165e019183","dirty":true},"run_id":"arb-step-typecheck-6fbf1f2912524e6faee71b76785e86e0","schema":"gzkit.arb.step_receipt.v1","stderr_tail":"","stderr_truncated":false,"stdout_tail":"All checks passed!\n","stdout_truncated":false,"step":{"command":["uv","run","ty","check","src"],"name":"typecheck"},"timestamp_utc":"2026-04-24T05:54:59Z"}
